{
  "schema": "teistro-conformance/baseline-bhava-bala/1",
  "fixture": "charts/c002-kathmandu-1985-12-25.json",
  "provenance": {
    "source": "baseline-engine",
    "evidence_rank": 2,
    "engine_version": "1.8.0",
    "exporter_version": "1.0.0",
    "inputs": "the fixture's foundation.lagna.sign_index, positions.bodies.*.house for the nine grahas, and the engine's Shadbala of the recorded chart (baseline/shadbala's file for the same fixture)"
  },
  "inputs": {
    "lagna_sign_index": 5,
    "graha_house": {
      "SUN": 4,
      "MOON": 9,
      "MARS": 2,
      "MERCURY": 3,
      "JUPITER": 5,
      "VENUS": 4,
      "SATURN": 3,
      "RAHU": 8,
      "KETU": 2
    },
    "shadbala": {
      "SUN": {
        "total_shashtiamshas": 360.46829026318215,
        "drik": 30
      },
      "MOON": {
        "total_shashtiamshas": 438.2548220175975,
        "drik": -60
      },
      "MARS": {
        "total_shashtiamshas": 435.2154192455625,
        "drik": 15
      },
      "MERCURY": {
        "total_shashtiamshas": 511.7454545006442,
        "drik": 60
      },
      "JUPITER": {
        "total_shashtiamshas": 294.5426746193512,
        "drik": -60
      },
      "VENUS": {
        "total_shashtiamshas": 429.61830223218595,
        "drik": 30
      },
      "SATURN": {
        "total_shashtiamshas": 404.60447711359797,
        "drik": 60
      }
    }
  },
  "aspected_by": {
    "1": ["JUPITER"],
    "2": ["RAHU"],
    "3": ["MOON"],
    "4": [],
    "5": ["MARS", "SATURN"],
    "6": [],
    "7": [],
    "8": ["MARS", "KETU"],
    "9": ["MARS", "MERCURY", "JUPITER", "SATURN"],
    "10": ["SUN", "VENUS"],
    "11": ["JUPITER"],
    "12": ["SATURN"]
  },
  "bhavas": [
    {
      "bhavadhipati": 511.75,
      "dig": 60,
      "drishti": -45,
      "total": 526.75
    },
    {
      "bhavadhipati": 429.62,
      "dig": 50,
      "drishti": -12.5,
      "total": 467.12
    },
    {
      "bhavadhipati": 435.22,
      "dig": 20,
      "drishti": 5,
      "total": 460.22
    },
    {
      "bhavadhipati": 294.54,
      "dig": 30,
      "drishti": 0,
      "total": 324.54
    },
    {
      "bhavadhipati": 404.6,
      "dig": 10,
      "drishti": -2.5,
      "total": 412.1
    },
    {
      "bhavadhipati": 404.6,
      "dig": 10,
      "drishti": 0,
      "total": 414.6
    },
    {
      "bhavadhipati": 294.54,
      "dig": 30,
      "drishti": 0,
      "total": 324.54
    },
    {
      "bhavadhipati": 435.22,
      "dig": 40,
      "drishti": -10,
      "total": 465.22
    },
    {
      "bhavadhipati": 429.62,
      "dig": 50,
      "drishti": 0,
      "total": 479.62
    },
    {
      "bhavadhipati": 511.75,
      "dig": 30,
      "drishti": 0,
      "total": 541.75
    },
    {
      "bhavadhipati": 438.25,
      "dig": 20,
      "drishti": -55,
      "total": 403.25
    },
    {
      "bhavadhipati": 360.47,
      "dig": 40,
      "drishti": -10,
      "total": 390.47
    }
  ]
}
