{
  "schema": "teistro-conformance/baseline-bhava-bala/1",
  "fixture": "variants/c018-sydney-2000-09-15--true-chitra.json",
  "provenance": {
    "source": "baseline-engine",
    "evidence_rank": 2,
    "engine_version": "1.8.0",
    "exporter_version": "1.0.0",
    "inputs": "the fixture's foundation.lagna.sign_index, positions.bodies.*.house for the nine grahas, and the engine's Shadbala of the recorded chart (baseline/shadbala's file for the same fixture)"
  },
  "inputs": {
    "lagna_sign_index": 11,
    "graha_house": {
      "SUN": 6,
      "MOON": 1,
      "MARS": 6,
      "MERCURY": 7,
      "JUPITER": 3,
      "VENUS": 7,
      "SATURN": 3,
      "RAHU": 4,
      "KETU": 10
    },
    "shadbala": {
      "SUN": {
        "total_shashtiamshas": 397.10019883831774,
        "drik": 0
      },
      "MOON": {
        "total_shashtiamshas": 496.61408558684036,
        "drik": -60
      },
      "MARS": {
        "total_shashtiamshas": 231.11719866828292,
        "drik": 0
      },
      "MERCURY": {
        "total_shashtiamshas": 484.52100042966975,
        "drik": 60
      },
      "JUPITER": {
        "total_shashtiamshas": 435.3294761902859,
        "drik": -15
      },
      "VENUS": {
        "total_shashtiamshas": 401.7644935757994,
        "drik": 60
      },
      "SATURN": {
        "total_shashtiamshas": 160.0525025499117,
        "drik": -15
      }
    }
  },
  "aspected_by": {
    "1": ["MARS", "MERCURY", "VENUS"],
    "2": [],
    "3": [],
    "4": ["KETU"],
    "5": ["SATURN"],
    "6": [],
    "7": ["MOON", "JUPITER"],
    "8": [],
    "9": ["MARS", "JUPITER", "SATURN"],
    "10": ["RAHU"],
    "11": ["JUPITER"],
    "12": ["SUN", "MARS", "SATURN"]
  },
  "bhavas": [
    {
      "bhavadhipati": 435.33,
      "dig": 30,
      "drishti": 60,
      "total": 525.33
    },
    {
      "bhavadhipati": 231.12,
      "dig": 20,
      "drishti": 0,
      "total": 251.12
    },
    {
      "bhavadhipati": 401.76,
      "dig": 10,
      "drishti": 0,
      "total": 411.76
    },
    {
      "bhavadhipati": 484.52,
      "dig": 30,
      "drishti": -7.5,
      "total": 507.02
    },
    {
      "bhavadhipati": 496.61,
      "dig": 40,
      "drishti": -10,
      "total": 526.61
    },
    {
      "bhavadhipati": 397.1,
      "dig": 20,
      "drishti": 0,
      "total": 417.1
    },
    {
      "bhavadhipati": 484.52,
      "dig": 0,
      "drishti": -15,
      "total": 469.52
    },
    {
      "bhavadhipati": 401.76,
      "dig": 10,
      "drishti": 0,
      "total": 411.76
    },
    {
      "bhavadhipati": 231.12,
      "dig": 40,
      "drishti": -15,
      "total": 256.12
    },
    {
      "bhavadhipati": 435.33,
      "dig": 30,
      "drishti": -7.5,
      "total": 457.83
    },
    {
      "bhavadhipati": 160.05,
      "dig": 50,
      "drishti": -2.5,
      "total": 207.55
    },
    {
      "bhavadhipati": 160.05,
      "dig": 50,
      "drishti": -12.5,
      "total": 197.55
    }
  ]
}
