{
  "schema": "teistro-conformance/baseline-bhava-bala/1",
  "fixture": "charts/c016-tokyo-2011-03-11.json",
  "provenance": {
    "source": "baseline-engine",
    "evidence_rank": 2,
    "engine_version": "1.8.0",
    "exporter_version": "1.0.0",
    "inputs": "the fixture's foundation.lagna.sign_index, positions.bodies.*.house for the nine grahas, and the engine's Shadbala of the recorded chart (baseline/shadbala's file for the same fixture)"
  },
  "inputs": {
    "lagna_sign_index": 3,
    "graha_house": {
      "SUN": 8,
      "MOON": 11,
      "MARS": 8,
      "MERCURY": 9,
      "JUPITER": 9,
      "VENUS": 7,
      "SATURN": 3,
      "RAHU": 6,
      "KETU": 12
    },
    "shadbala": {
      "SUN": {
        "total_shashtiamshas": 366.9136959615799,
        "drik": 15
      },
      "MOON": {
        "total_shashtiamshas": 354.7556089644579,
        "drik": -60
      },
      "MARS": {
        "total_shashtiamshas": 271.3499286289294,
        "drik": 15
      },
      "MERCURY": {
        "total_shashtiamshas": 343.6039133485594,
        "drik": -45
      },
      "JUPITER": {
        "total_shashtiamshas": 371.98669221339327,
        "drik": -45
      },
      "VENUS": {
        "total_shashtiamshas": 459.8184942945358,
        "drik": 0
      },
      "SATURN": {
        "total_shashtiamshas": 367.8395399175354,
        "drik": -45
      }
    }
  },
  "aspected_by": {
    "1": ["JUPITER", "VENUS"],
    "2": ["SUN", "MARS"],
    "3": ["MARS", "MERCURY", "JUPITER"],
    "4": [],
    "5": ["MOON", "JUPITER", "SATURN"],
    "6": ["KETU"],
    "7": [],
    "8": [],
    "9": ["SATURN"],
    "10": [],
    "11": ["MARS"],
    "12": ["SATURN", "RAHU"]
  },
  "bhavas": [
    {
      "bhavadhipati": 354.76,
      "dig": 0,
      "drishti": -45,
      "total": 309.76
    },
    {
      "bhavadhipati": 366.91,
      "dig": 20,
      "drishti": -5,
      "total": 381.91
    },
    {
      "bhavadhipati": 343.6,
      "dig": 40,
      "drishti": -90,
      "total": 293.6
    },
    {
      "bhavadhipati": 459.82,
      "dig": 30,
      "drishti": 0,
      "total": 489.82
    },
    {
      "bhavadhipati": 271.35,
      "dig": 40,
      "drishti": -45,
      "total": 266.35
    },
    {
      "bhavadhipati": 371.99,
      "dig": 10,
      "drishti": -2.5,
      "total": 379.49
    },
    {
      "bhavadhipati": 367.84,
      "dig": 30,
      "drishti": 0,
      "total": 397.84
    },
    {
      "bhavadhipati": 367.84,
      "dig": 10,
      "drishti": 0,
      "total": 377.84
    },
    {
      "bhavadhipati": 371.99,
      "dig": 10,
      "drishti": -2.5,
      "total": 379.49
    },
    {
      "bhavadhipati": 271.35,
      "dig": 60,
      "drishti": 0,
      "total": 331.35
    },
    {
      "bhavadhipati": 459.82,
      "dig": 50,
      "drishti": -12.5,
      "total": 497.32
    },
    {
      "bhavadhipati": 343.6,
      "dig": 50,
      "drishti": -12.5,
      "total": 381.1
    }
  ]
}
