{
  "schema": "teistro-conformance/baseline-bhava-bala/1",
  "fixture": "charts/c011-kolkata-1880-06-10.json",
  "provenance": {
    "source": "baseline-engine",
    "evidence_rank": 2,
    "engine_version": "1.8.0",
    "exporter_version": "1.0.0",
    "inputs": "the fixture's foundation.lagna.sign_index, positions.bodies.*.house for the nine grahas, and the engine's Shadbala of the recorded chart (baseline/shadbala's file for the same fixture)"
  },
  "inputs": {
    "lagna_sign_index": 2,
    "graha_house": {
      "SUN": 12,
      "MOON": 1,
      "MARS": 2,
      "MERCURY": 1,
      "JUPITER": 10,
      "VENUS": 12,
      "SATURN": 11,
      "RAHU": 7,
      "KETU": 1
    },
    "shadbala": {
      "SUN": {
        "total_shashtiamshas": 383.46401906011573,
        "drik": 15
      },
      "MOON": {
        "total_shashtiamshas": 288.2213366029503,
        "drik": -15
      },
      "MARS": {
        "total_shashtiamshas": 306.79280255362835,
        "drik": 15
      },
      "MERCURY": {
        "total_shashtiamshas": 470.2578608155069,
        "drik": -15
      },
      "JUPITER": {
        "total_shashtiamshas": 448.7095029188227,
        "drik": -30
      },
      "VENUS": {
        "total_shashtiamshas": 422.0223608437849,
        "drik": 15
      },
      "SATURN": {
        "total_shashtiamshas": 187.02738116566994,
        "drik": -15
      }
    }
  },
  "aspected_by": {
    "1": ["SATURN", "RAHU"],
    "2": ["JUPITER"],
    "3": [],
    "4": ["JUPITER"],
    "5": ["MARS", "SATURN"],
    "6": ["SUN", "JUPITER", "VENUS"],
    "7": ["MOON", "MERCURY", "KETU"],
    "8": ["MARS", "SATURN"],
    "9": ["MARS"],
    "10": [],
    "11": [],
    "12": []
  },
  "bhavas": [
    {
      "bhavadhipati": 470.26,
      "dig": 60,
      "drishti": -15,
      "total": 515.26
    },
    {
      "bhavadhipati": 288.22,
      "dig": 10,
      "drishti": -27.5,
      "total": 270.72
    },
    {
      "bhavadhipati": 383.46,
      "dig": 10,
      "drishti": 0,
      "total": 393.46
    },
    {
      "bhavadhipati": 470.26,
      "dig": 30,
      "drishti": -22.5,
      "total": 477.76
    },
    {
      "bhavadhipati": 422.02,
      "dig": 20,
      "drishti": -5,
      "total": 437.02
    },
    {
      "bhavadhipati": 306.79,
      "dig": 50,
      "drishti": -30,
      "total": 326.79
    },
    {
      "bhavadhipati": 448.71,
      "dig": 0,
      "drishti": -15,
      "total": 433.71
    },
    {
      "bhavadhipati": 187.03,
      "dig": 40,
      "drishti": -10,
      "total": 217.03
    },
    {
      "bhavadhipati": 187.03,
      "dig": 20,
      "drishti": -5,
      "total": 202.03
    },
    {
      "bhavadhipati": 448.71,
      "dig": 0,
      "drishti": 0,
      "total": 448.71
    },
    {
      "bhavadhipati": 306.79,
      "dig": 50,
      "drishti": 0,
      "total": 356.79
    },
    {
      "bhavadhipati": 422.02,
      "dig": 40,
      "drishti": 0,
      "total": 462.02
    }
  ]
}
