{
  "schema": "teistro-conformance/baseline-bhava-bala/1",
  "fixture": "charts/c042-quito-2001-01-01.json",
  "provenance": {
    "source": "baseline-engine",
    "evidence_rank": 2,
    "engine_version": "1.8.0",
    "exporter_version": "1.0.0",
    "inputs": "the fixture's foundation.lagna.sign_index, positions.bodies.*.house for the nine grahas, and the engine's Shadbala of the recorded chart (baseline/shadbala's file for the same fixture)"
  },
  "inputs": {
    "lagna_sign_index": 5,
    "graha_house": {
      "SUN": 4,
      "MOON": 6,
      "MARS": 2,
      "MERCURY": 4,
      "JUPITER": 9,
      "VENUS": 6,
      "SATURN": 9,
      "RAHU": 10,
      "KETU": 4
    },
    "shadbala": {
      "SUN": {
        "total_shashtiamshas": 345.60655308194146,
        "drik": -15
      },
      "MOON": {
        "total_shashtiamshas": 379.61857222481325,
        "drik": -60
      },
      "MARS": {
        "total_shashtiamshas": 359.9575718113433,
        "drik": 60
      },
      "MERCURY": {
        "total_shashtiamshas": 411.3136601138256,
        "drik": -15
      },
      "JUPITER": {
        "total_shashtiamshas": 516.7615440699819,
        "drik": 30
      },
      "VENUS": {
        "total_shashtiamshas": 265.43300671764115,
        "drik": -60
      },
      "SATURN": {
        "total_shashtiamshas": 287.40997630469593,
        "drik": 30
      }
    }
  },
  "aspected_by": {
    "1": ["JUPITER"],
    "2": [],
    "3": ["JUPITER", "SATURN"],
    "4": ["RAHU"],
    "5": ["MARS", "JUPITER"],
    "6": ["SATURN"],
    "7": [],
    "8": ["MARS"],
    "9": ["MARS"],
    "10": ["SUN", "MERCURY", "KETU"],
    "11": ["SATURN"],
    "12": ["MOON", "VENUS"]
  },
  "bhavas": [
    {
      "bhavadhipati": 411.31,
      "dig": 60,
      "drishti": 45,
      "total": 516.31
    },
    {
      "bhavadhipati": 265.43,
      "dig": 50,
      "drishti": 0,
      "total": 315.43
    },
    {
      "bhavadhipati": 359.96,
      "dig": 20,
      "drishti": 30,
      "total": 409.96
    },
    {
      "bhavadhipati": 516.76,
      "dig": 30,
      "drishti": -7.5,
      "total": 539.26
    },
    {
      "bhavadhipati": 287.41,
      "dig": 10,
      "drishti": 30,
      "total": 327.41
    },
    {
      "bhavadhipati": 287.41,
      "dig": 10,
      "drishti": -2.5,
      "total": 294.91
    },
    {
      "bhavadhipati": 516.76,
      "dig": 30,
      "drishti": 0,
      "total": 546.76
    },
    {
      "bhavadhipati": 359.96,
      "dig": 40,
      "drishti": -10,
      "total": 389.96
    },
    {
      "bhavadhipati": 265.43,
      "dig": 50,
      "drishti": -12.5,
      "total": 302.93
    },
    {
      "bhavadhipati": 411.31,
      "dig": 30,
      "drishti": -15,
      "total": 426.31
    },
    {
      "bhavadhipati": 379.62,
      "dig": 20,
      "drishti": -5,
      "total": 394.62
    },
    {
      "bhavadhipati": 345.61,
      "dig": 40,
      "drishti": 10,
      "total": 395.61
    }
  ]
}
